index,name,type,rating,2-sat,binary search,bitmasks,brute force,chinese remainder theorem,combinatorics,constructive algorithms,data structures,dfs and similar,divide and conquer,dp,dsu,expression parsing,fft,flows,games,geometry,graph matchings,graphs,greedy,hashing,implementation,interactive,math,matrices,meet-in-the-middle,number theory,probabilities,schedules,shortest paths,sortings,string suffix structures,strings,ternary search,trees,two pointers
A,Marcin and Training Camp,PROGRAMMING,1700,0,0,0,1,0,0,0,0,0,0,0,0,0,0,0,0,0,0,1,1,0,0,0,0,0,0,0,0,0,0,0,0,0,0,0,0
B,Kamil and Making a Stream,PROGRAMMING,2000,0,1,0,0,0,0,0,1,1,0,1,0,0,0,0,0,0,0,1,0,0,0,0,1,0,0,1,0,0,0,0,0,0,0,1,0
C,Konrad and Company Evaluation,PROGRAMMING,2400,0,0,0,1,0,0,0,0,0,0,0,0,0,0,0,0,0,0,1,0,0,0,0,0,0,0,0,0,0,0,0,0,0,0,0,0
D,Wojtek and Card Tricks,PROGRAMMING,2700,0,0,0,0,0,0,0,0,0,0,0,0,0,0,0,0,0,0,0,0,0,0,0,1,0,0,0,0,0,0,0,0,0,0,0,0
E1,Marek and Matching (easy version),PROGRAMMING,3100,0,0,0,1,0,0,0,0,0,0,0,0,0,0,0,0,0,0,0,0,0,0,0,0,0,0,0,1,0,0,0,0,0,0,0,0
E2,Marek and Matching (hard version),PROGRAMMING,3200,0,0,0,1,0,0,0,0,0,0,0,0,0,0,0,0,0,0,0,0,0,0,0,0,0,0,0,1,0,0,0,0,0,0,0,0
F,Mateusz and Escape Room,PROGRAMMING,3500,0,0,0,0,0,0,0,0,0,0,1,0,0,0,0,0,0,0,0,0,0,0,0,0,0,0,0,0,0,0,0,0,0,0,0,0
