index,name,type,rating,2-sat,binary search,bitmasks,brute force,chinese remainder theorem,combinatorics,constructive algorithms,data structures,dfs and similar,divide and conquer,dp,dsu,expression parsing,fft,flows,games,geometry,graph matchings,graphs,greedy,hashing,implementation,interactive,math,matrices,meet-in-the-middle,number theory,probabilities,schedules,shortest paths,sortings,string suffix structures,strings,ternary search,trees,two pointers
A,Find K Distinct Points with Fixed Center,PROGRAMMING,800,0,0,0,0,0,0,1,0,0,0,0,0,0,0,0,0,0,0,0,0,0,1,0,1,0,0,0,0,0,0,0,0,0,0,0,0
B,Minimize Equal Sum Subarrays,PROGRAMMING,1000,0,0,0,0,0,0,1,0,0,0,0,0,0,0,0,0,0,0,0,0,0,0,0,1,0,0,1,0,0,0,0,0,0,0,0,0
C,Perform Operations to Maximize Score,PROGRAMMING,1900,0,1,0,1,0,0,1,0,0,0,0,0,0,0,0,0,0,0,0,1,0,1,0,0,0,0,0,0,0,0,0,0,0,0,0,0
D,Determine Winning Islands in Race,PROGRAMMING,2100,0,0,0,0,0,0,0,1,0,0,1,0,0,0,0,0,0,0,1,1,0,0,0,0,0,0,0,0,0,1,0,0,0,0,0,0
E1,Eliminating Balls With Merging (Easy Version),PROGRAMMING,2200,0,1,0,1,0,0,0,1,0,1,0,0,0,0,0,0,0,0,0,1,0,0,0,0,0,0,0,0,0,0,0,0,0,0,0,0
E2,Eliminating Balls With Merging (Hard Version),PROGRAMMING,2500,0,1,0,1,0,0,0,1,0,1,0,0,0,0,0,0,0,0,0,1,0,1,0,0,0,0,0,0,0,0,0,0,0,0,0,0
