index,name,type,rating,2-sat,binary search,bitmasks,brute force,chinese remainder theorem,combinatorics,constructive algorithms,data structures,dfs and similar,divide and conquer,dp,dsu,expression parsing,fft,flows,games,geometry,graph matchings,graphs,greedy,hashing,implementation,interactive,math,matrices,meet-in-the-middle,number theory,probabilities,schedules,shortest paths,sortings,string suffix structures,strings,ternary search,trees,two pointers
A,Lunar New Year and Cross Counting,PROGRAMMING,800,0,0,0,0,0,0,0,0,0,0,0,0,0,0,0,0,0,0,0,0,0,1,0,0,0,0,0,0,0,0,0,0,0,0,0,0
B,Lunar New Year and Food Ordering,PROGRAMMING,1500,0,0,0,0,0,0,0,1,0,0,0,0,0,0,0,0,0,0,0,0,0,1,0,0,0,0,0,0,0,0,0,0,0,0,0,0
C,Lunar New Year and Number Division,PROGRAMMING,900,0,0,0,0,0,0,0,0,0,0,0,0,0,0,0,0,0,0,0,1,0,1,0,1,0,0,0,0,0,0,1,0,0,0,0,0
D,Lunar New Year and a Wander,PROGRAMMING,1500,0,0,0,0,0,0,0,1,1,0,0,0,0,0,0,0,0,0,1,1,0,0,0,0,0,0,0,0,0,1,0,0,0,0,0,0
E,Lunar New Year and Red Envelopes,PROGRAMMING,2100,0,0,0,0,0,0,0,1,0,0,1,0,0,0,0,0,0,0,0,0,0,0,0,0,0,0,0,0,0,0,0,0,0,0,0,0
F,Lunar New Year and a Recursive Sequence,PROGRAMMING,2400,0,0,0,0,0,0,0,0,0,0,0,0,0,0,0,0,0,0,0,0,0,0,0,1,1,0,1,0,0,0,0,0,0,0,0,0
