index,name,type,rating,2-sat,binary search,bitmasks,brute force,chinese remainder theorem,combinatorics,constructive algorithms,data structures,dfs and similar,divide and conquer,dp,dsu,expression parsing,fft,flows,games,geometry,graph matchings,graphs,greedy,hashing,implementation,interactive,math,matrices,meet-in-the-middle,number theory,probabilities,schedules,shortest paths,sortings,string suffix structures,strings,ternary search,trees,two pointers
A,Little Elephant and Rozdil,PROGRAMMING,900,0,0,0,1,0,0,0,0,0,0,0,0,0,0,0,0,0,0,0,0,0,1,0,0,0,0,0,0,0,0,0,0,0,0,0,0
B,Little Elephant and Sorting,PROGRAMMING,1400,0,0,0,1,0,0,0,0,0,0,0,0,0,0,0,0,0,0,0,1,0,0,0,0,0,0,0,0,0,0,0,0,0,0,0,0
C,Little Elephant and Interval,PROGRAMMING,1500,0,1,0,1,0,1,0,0,0,0,1,0,0,0,0,0,0,0,0,0,0,0,0,1,0,0,0,0,0,0,0,0,0,0,0,0
D,Little Elephant and Cards,PROGRAMMING,1500,0,1,0,1,0,0,0,0,0,0,0,0,0,0,0,0,0,0,0,0,0,0,0,0,0,0,0,0,0,0,1,0,0,0,0,0
E,Little Elephant and Furik and Rubik,PROGRAMMING,2000,0,0,0,1,0,1,0,0,0,0,0,0,0,0,0,0,0,0,0,0,0,0,0,0,0,0,0,1,0,0,0,0,0,0,0,0
